{
  "$schema": "https://json-schema.org/draft/2020-12/schema",
  "title": "SKRAFT pipeline state",
  "description": "{trackingRoot}/{projectSlug}/state.json, written only by src/cli/state.mjs (report.mjs setup writes userPreferences.reporting). x-owner mirrors STATE_SCHEMA in state-schema.mjs: 'invariant' fields are owned by the state machine, 'orchestrator' fields by the orchestrator through state.mjs set or phase events.",
  "type": "object",
  "required": ["currentPhase"],
  "additionalProperties": false,
  "$defs": {
    "phaseMap": {
      "description": "Keyed by phase name (skraft-framework.config.json::phaseOrder).",
      "type": "object"
    },
    "paths": {
      "type": "array",
      "items": { "type": "string", "minLength": 1 }
    },
    "count": { "type": "integer", "minimum": 0 },
    "nullablePath": {
      "anyOf": [{ "type": "string", "minLength": 1 }, { "type": "null" }]
    }
  },
  "properties": {
    "projectSlug": {
      "x-owner": "orchestrator",
      "description": "Kebab-case identifier of the pipeline; the name of its tracking directory.",
      "anyOf": [{ "type": "string", "minLength": 1 }, { "type": "null" }]
    },
    "skraftPlanFile": {
      "x-owner": "orchestrator",
      "$ref": "#/$defs/nullablePath"
    },
    "currentPhase": {
      "x-owner": "invariant",
      "description": "The phase being executed, a phase of phaseOrder, or DONE once every phase closed. Advances only through transition or close-phase.",
      "type": "string",
      "minLength": 1
    },
    "entryMode": {
      "x-owner": "orchestrator",
      "enum": ["capture", "from-issue", "from-prd", null]
    },
    "issueNumber": {
      "x-owner": "orchestrator",
      "anyOf": [{ "type": "integer", "minimum": 1 }, { "type": "null" }]
    },
    "phasesCompleted": {
      "x-owner": "invariant",
      "description": "Closed phases, in closing order. Append-only.",
      "type": "array",
      "items": { "type": "string", "minLength": 1 }
    },
    "phaseArtifacts": {
      "x-owner": "invariant",
      "description": "Artefacts each phase recorded with record-artifact, relative to the tracking directory. Append-only.",
      "$ref": "#/$defs/phaseMap",
      "additionalProperties": { "$ref": "#/$defs/paths" }
    },
    "verdicts": {
      "x-owner": "invariant",
      "description": "Reviewer verdict per phase. A review's NEEDS_REWORK or REJECTED records as CHANGES_REQUESTED.",
      "$ref": "#/$defs/phaseMap",
      "additionalProperties": { "enum": ["APPROVED", "CHANGES_REQUESTED", null] }
    },
    "reviewArtifacts": {
      "x-owner": "invariant",
      "description": "Review files per phase under reviews/{date}/, relative to the tracking directory. Append-only; the latest one decides the phase gate.",
      "$ref": "#/$defs/phaseMap",
      "additionalProperties": { "$ref": "#/$defs/paths" }
    },
    "retryCount": {
      "x-owner": "invariant",
      "description": "Automated reviewer retries per phase, capped at userPreferences.maxRetriesPerPhase.",
      "$ref": "#/$defs/phaseMap",
      "additionalProperties": { "$ref": "#/$defs/count" }
    },
    "reworkCount": {
      "x-owner": "invariant",
      "description": "Manual, human-validated rework passes per phase (incr-rework). Uncapped.",
      "$ref": "#/$defs/phaseMap",
      "additionalProperties": { "$ref": "#/$defs/count" }
    },
    "findingsResolved": {
      "x-owner": "invariant",
      "description": "Review findings resolved across the rework passes of each phase (incr-rework --findings).",
      "$ref": "#/$defs/phaseMap",
      "additionalProperties": { "$ref": "#/$defs/count" }
    },
    "referencesProcessed": {
      "x-owner": "orchestrator",
      "$ref": "#/$defs/paths"
    },
    "phaseHistory": {
      "x-owner": "orchestrator",
      "description": "Written by mark-phase-started (inProgress, startedAt, baseSha) and by phase closure (done, completedAt). DELIVER's baseSha bounds the commits its gate requires.",
      "$ref": "#/$defs/phaseMap",
      "additionalProperties": {
        "type": "object",
        "required": ["status"],
        "additionalProperties": false,
        "properties": {
          "status": { "enum": ["inProgress", "done"] },
          "startedAt": { "type": "string", "minLength": 1 },
          "baseSha": { "anyOf": [{ "type": "string", "minLength": 1 }, { "type": "null" }] },
          "completedAt": { "type": "string", "minLength": 1 }
        }
      }
    },
    "nextActions": {
      "x-owner": "orchestrator",
      "type": "array",
      "items": { "type": "string", "minLength": 1 }
    },
    "userPreferences": {
      "x-owner": "invariant",
      "type": "object",
      "additionalProperties": false,
      "properties": {
        "autonomyTier": { "enum": ["full", "partial", "manual"] },
        "phaseOrder": {
          "description": "Overrides skraft-framework.config.json::phaseOrder for this pipeline's transitions.",
          "type": "array",
          "items": { "type": "string", "minLength": 1 }
        },
        "maxRetriesPerPhase": {
          "description": "Automated retries allowed per phase before the orchestrator escalates. Default 2.",
          "$ref": "#/$defs/count"
        },
        "reporting": {
          "description": "Confirmed reporting preferences, written by report.mjs setup and validated by reporting-preferences.mjs; see skills/qa-reporting/references/report-contract.md.",
          "type": "object"
        }
      }
    },
    "neighborPlanners": {
      "x-owner": "orchestrator",
      "type": "object",
      "additionalProperties": false,
      "properties": {
        "securityPlanFile": { "$ref": "#/$defs/nullablePath" },
        "raiPlanFile": { "$ref": "#/$defs/nullablePath" },
        "ssscPlanFile": { "$ref": "#/$defs/nullablePath" }
      }
    },
    "adrRatification": {
      "x-owner": "orchestrator",
      "description": "DESIGN human-ratification checkpoint. awaiting_human while Proposed ADRs wait for the human; resolved once none remain. DESIGN advances to DISTILL only when resolved.",
      "type": "object",
      "required": ["checkpointStatus", "pending", "ratified"],
      "additionalProperties": false,
      "properties": {
        "checkpointStatus": { "enum": ["none", "awaiting_human", "resolved", null] },
        "pending": {
          "description": "Rows of docs/adr/decisions-index.md still Proposed.",
          "type": "array",
          "items": {
            "type": "object",
            "required": ["adr", "title", "recommended", "status"],
            "additionalProperties": false,
            "properties": {
              "adr": { "type": "string", "minLength": 1 },
              "title": { "type": "string", "minLength": 1 },
              "recommended": { "enum": ["accept", "reject"] },
              "status": { "const": "Proposed" }
            }
          }
        },
        "ratified": {
          "type": "array",
          "items": {
            "type": "object",
            "required": ["adr", "verdict", "by"],
            "additionalProperties": false,
            "properties": {
              "adr": { "type": "string", "minLength": 1 },
              "verdict": { "enum": ["Accepted", "Rejected"] },
              "by": { "type": "string", "minLength": 1 }
            }
          }
        }
      }
    }
  }
}
