{
  "projectSlug": "checkout-pricing",
  "currentPhase": "DESIGN",
  "issueNumber": null,
  "adrRatification": {
    "checkpointStatus": "resolved",
    "pending": [],
    "ratified": [
      { "adr": "002", "verdict": "Accepted", "by": "sebastiendegodez (2026-08-12)" }
    ]
  },
  "phasesCompleted": [
    "RESEARCH"
  ],
  "phaseArtifacts": {
    "DESIGN": [
      ".copilot-tracking/skraft-plans/checkout-pricing/details/2026-08-12/contracts-loyalty-discount.md",
      ".copilot-tracking/skraft-plans/checkout-pricing/details/2026-08-12/diagrams-loyalty-discount.md",
      ".copilot-tracking/skraft-plans/checkout-pricing/details/2026-08-12/consistency-matrix-loyalty-discount.md"
    ]
  },
  "verdicts": {
    "RESEARCH": "APPROVED"
  },
  "reviewArtifacts": {},
  "retryCount": {},
  "reworkCount": {},
  "findingsResolved": {},
  "phaseHistory": {
    "DESIGN": {
      "status": "inProgress",
      "startedAt": "2026-08-12T09:40:00Z"
    }
  },
  "nextActions": [
    "Review the loyalty-discount design before DISTILL starts."
  ],
  "userPreferences": {
    "maxRetriesPerPhase": 2
  },
  "neighborPlanners": {
    "securityPlanFile": null,
    "raiPlanFile": null,
    "ssscPlanFile": null
  }
}
