{
  "projectSlug": "orders",
  "currentPhase": "DELIVER",
  "issueNumber": null,
  "adrRatification": { "checkpointStatus": "resolved", "pending": [], "ratified": [] },
  "phasesCompleted": ["RESEARCH", "DESIGN", "DISTILL"],
  "phaseArtifacts": {
    "DISTILL": [
      ".copilot-tracking/skraft-plans/orders/features/order-discount.feature",
      ".copilot-tracking/skraft-plans/orders/details/2026-08-28/impl-plan-order-discount.md"
    ]
  },
  "verdicts": { "RESEARCH": "APPROVED", "DESIGN": "APPROVED", "DISTILL": "APPROVED" },
  "reviewArtifacts": {},
  "retryCount": {},
  "reworkCount": {},
  "findingsResolved": {},
  "phaseHistory": {
    "RESEARCH": { "status": "done", "startedAt": "2026-08-28T08:00:00Z", "completedAt": "2026-08-28T08:10:00Z" },
    "DESIGN": { "status": "done", "startedAt": "2026-08-28T08:10:00Z", "completedAt": "2026-08-28T08:20:00Z" },
    "DISTILL": { "status": "done", "startedAt": "2026-08-28T08:20:00Z", "completedAt": "2026-08-28T08:30:00Z" },
    "DELIVER": { "status": "inProgress", "startedAt": "2026-08-28T08:30:00Z" }
  },
  "nextActions": ["Verify the completed implementation and close DELIVER only if every gate passes."],
  "userPreferences": {
    "maxRetriesPerPhase": 0
  },
  "neighborPlanners": { "securityPlanFile": null, "raiPlanFile": null, "ssscPlanFile": null }
}