{
  "projectSlug": "checkout-pricing",
  "skraftPlanFile": ".copilot-tracking/skraft-plans/checkout-pricing/state.json",
  "currentPhase": "DESIGN",
  "entryMode": "capture",
  "issueNumber": null,
  "adrRatification": {
    "checkpointStatus": "resolved",
    "pending": [],
    "ratified": []
  },
  "phasesCompleted": [
    "RESEARCH"
  ],
  "phaseArtifacts": {},
  "verdicts": {
    "RESEARCH": "APPROVED"
  },
  "reviewArtifacts": {},
  "retryCount": {},
  "reworkCount": {},
  "findingsResolved": {},
  "referencesProcessed": [],
  "phaseHistory": {
    "DESIGN": {
      "status": "inProgress",
      "startedAt": "2026-08-13T09:00:00Z"
    }
  },
  "nextActions": [
    "Design the loyalty-discount story, then have the design reviewed."
  ],
  "userPreferences": {
    "autonomyTier": "full",
    "maxRetriesPerPhase": 2,
    "phaseOrder": [
      "RESEARCH",
      "DESIGN",
      "DISTILL",
      "DELIVER"
    ]
  },
  "neighborPlanners": {
    "securityPlanFile": null,
    "raiPlanFile": null,
    "ssscPlanFile": null
  }
}
