{
  "projectSlug": "pricing",
  "currentPhase": "DESIGN",
  "adrRatification": {
    "checkpointStatus": "resolved",
    "pending": [],
    "ratified": []
  },
  "phasesCompleted": [
    "RESEARCH"
  ],
  "phaseArtifacts": {
    "RESEARCH": [
      "research/2026-08-12/discount-research.md"
    ],
    "DESIGN": [
      "details/2026-08-14/event-model-discount.md",
      "details/2026-08-14/diagrams-discount.md",
      "details/2026-08-14/contracts-discount.md",
      "details/2026-08-14/context-map.md",
      "details/2026-08-14/consistency-matrix-discount.md"
    ]
  },
  "verdicts": {
    "RESEARCH": "APPROVED"
  },
  "reviewArtifacts": {},
  "retryCount": {},
  "reworkCount": {},
  "findingsResolved": {},
  "phaseHistory": {
    "RESEARCH": {
      "status": "done",
      "startedAt": "2026-08-12T09:00:00Z",
      "baseSha": null,
      "completedAt": "2026-08-12T11:30:00Z"
    },
    "DESIGN": {
      "status": "inProgress",
      "startedAt": "2026-08-14T09:00:00Z",
      "baseSha": null
    }
  },
  "userPreferences": {
    "maxRetriesPerPhase": 2,
    "reporting": {
      "confirmed": true,
      "repo": null,
      "branch": "",
      "prNumber": null,
      "issueNumber": null,
      "destinations": {
        "pr": false,
        "issue": "none",
        "chat": true
      },
      "maxMedia": 0,
      "allowDraftPr": false
    }
  }
}
