{
  "projectSlug": "storefront",
  "currentPhase": "DELIVER",
  "adrRatification": { "checkpointStatus": "resolved", "pending": [], "ratified": [] },
  "phasesCompleted": ["RESEARCH", "DESIGN", "DISTILL"],
  "phaseArtifacts": {
    "DISTILL": [
      ".copilot-tracking/skraft-plans/storefront/features/basket-price.feature",
      ".copilot-tracking/skraft-plans/storefront/details/2026-08-28/impl-plan-basket-price.md"
    ]
  },
  "verdicts": { "RESEARCH": "APPROVED", "DESIGN": "APPROVED", "DISTILL": "APPROVED" },
  "reviewArtifacts": {},
  "retryCount": {},
  "reworkCount": {},
  "findingsResolved": {},
  "phaseHistory": {
    "RESEARCH": { "status": "done", "startedAt": "2026-08-28T08:00:00Z", "completedAt": "2026-08-28T08:10:00Z" },
    "DESIGN": { "status": "done", "startedAt": "2026-08-28T08:10:00Z", "completedAt": "2026-08-28T08:20:00Z" },
    "DISTILL": { "status": "done", "startedAt": "2026-08-28T08:20:00Z", "completedAt": "2026-08-28T08:30:00Z" },
    "DELIVER": { "status": "inProgress", "startedAt": "2026-08-28T08:30:00Z" }
  },
  "userPreferences": {
    "maxRetriesPerPhase": 0
  }
}