{
  "projectSlug": "refund",
  "currentPhase": "DONE",
  "phasesCompleted": ["RESEARCH", "DESIGN", "DISTILL", "DELIVER"],
  "phaseArtifacts": { "RESEARCH": ["research/report.md"], "DESIGN": ["design/architecture.md"] },
  "verdicts": { "RESEARCH": "APPROVED", "DESIGN": "APPROVED", "DISTILL": "APPROVED", "DELIVER": "APPROVED" },
  "retryCount": { "DESIGN": 1 },
  "reworkCount": {},
  "phaseHistory": {
    "RESEARCH": { "status": "done", "startedAt": "2026-10-01T10:00:00.000Z", "completedAt": "2026-10-01T10:20:00.000Z" },
    "DESIGN": { "status": "done", "startedAt": "2026-10-01T10:20:00.000Z", "completedAt": "2026-10-01T10:40:00.000Z" },
    "DISTILL": { "status": "done", "startedAt": "2026-10-01T10:40:00.000Z", "completedAt": "2026-10-01T11:00:00.000Z" },
    "DELIVER": { "status": "done", "startedAt": "2026-10-01T11:00:00.000Z", "baseSha": "abc123", "completedAt": "2026-10-01T12:00:00.000Z" }
  }
}
